{
  "$schema": "https://json-schema.org/draft/2020-12/schema",
  "$id": "urn:eaos:finding:1",
  "type": "object",
  "required": [
    "id",
    "category",
    "subcategory",
    "location",
    "current_behavior",
    "expected_behavior",
    "root_cause",
    "why_this_matters",
    "recommended_remediation",
    "implementation_strategy",
    "regression_risks",
    "verification_method",
    "affected_files",
    "affected_components",
    "affected_flows",
    "required_tests",
    "dependencies",
    "evidence_ids",
    "control_ids",
    "severity",
    "confidence",
    "claim_status",
    "root_cause_status",
    "priority",
    "status",
    "impacts",
    "verification_ids",
    "owner",
    "risk_expiry",
    "duplicate_of",
    "priority_rationale",
    "revision",
    "required_gate_ids"
  ],
  "properties": {
    "id": {
      "type": "string",
      "minLength": 1
    },
    "category": {
      "type": "string",
      "minLength": 1
    },
    "subcategory": {
      "type": "string",
      "minLength": 1
    },
    "location": {
      "type": "string",
      "minLength": 1
    },
    "current_behavior": {
      "type": "string",
      "minLength": 1
    },
    "expected_behavior": {
      "type": "string",
      "minLength": 1
    },
    "root_cause": {
      "type": "string",
      "minLength": 1
    },
    "why_this_matters": {
      "type": "string",
      "minLength": 1
    },
    "recommended_remediation": {
      "type": "string",
      "minLength": 1
    },
    "implementation_strategy": {
      "type": "string",
      "minLength": 1
    },
    "regression_risks": {
      "type": "string",
      "minLength": 1
    },
    "verification_method": {
      "type": "string",
      "minLength": 1
    },
    "affected_files": {
      "type": "array",
      "items": {
        "type": "string"
      }
    },
    "affected_components": {
      "type": "array",
      "items": {
        "type": "string"
      }
    },
    "affected_flows": {
      "type": "array",
      "items": {
        "type": "string"
      }
    },
    "required_tests": {
      "type": "array",
      "items": {
        "type": "string"
      }
    },
    "dependencies": {
      "type": "array",
      "items": {
        "type": "string"
      }
    },
    "evidence_ids": {
      "type": "array",
      "items": {
        "type": "string"
      }
    },
    "control_ids": {
      "type": "array",
      "items": {
        "type": "string"
      }
    },
    "severity": {
      "enum": [
        "CRITICAL",
        "HIGH",
        "MEDIUM",
        "LOW",
        "INFO"
      ]
    },
    "confidence": {
      "enum": [
        "HIGH",
        "MEDIUM",
        "LOW"
      ]
    },
    "claim_status": {
      "enum": [
        "CONFIRMED",
        "HIGHLY_LIKELY",
        "POSSIBLE",
        "NOT_VERIFIED"
      ]
    },
    "root_cause_status": {
      "enum": [
        "CONFIRMED",
        "HYPOTHESIS",
        "UNKNOWN"
      ]
    },
    "priority": {
      "enum": [
        "P0",
        "P1",
        "P2",
        "P3"
      ]
    },
    "status": {
      "enum": [
        "open",
        "triaged",
        "planned",
        "in_progress",
        "fixed_pending_verification",
        "verified_closed",
        "accepted_risk",
        "deferred",
        "false_positive",
        "duplicate"
      ]
    },
    "impacts": {
      "type": "object",
      "required": [
        "security",
        "performance",
        "reliability",
        "maintainability",
        "user",
        "business"
      ],
      "properties": {
        "security": {
          "type": "string"
        },
        "performance": {
          "type": "string"
        },
        "reliability": {
          "type": "string"
        },
        "maintainability": {
          "type": "string"
        },
        "user": {
          "type": "string"
        },
        "business": {
          "type": "string"
        }
      },
      "additionalProperties": false
    },
    "verification_ids": {
      "type": "array",
      "items": {
        "type": "string"
      }
    },
    "owner": {
      "type": "string"
    },
    "risk_expiry": {
      "type": [
        "string",
        "null"
      ]
    },
    "duplicate_of": {
      "type": [
        "string",
        "null"
      ]
    },
    "priority_rationale": {
      "type": "string"
    },
    "revision": {
      "type": "string"
    },
    "required_gate_ids": {
      "type": "array",
      "items": {
        "type": "string"
      }
    }
  },
  "additionalProperties": false
}
