{
  "id": "F-001",
  "category": "REPLACE",
  "subcategory": "REPLACE",
  "location": "REPLACE",
  "current_behavior": "REPLACE",
  "expected_behavior": "REPLACE",
  "root_cause": "REPLACE",
  "why_this_matters": "REPLACE",
  "recommended_remediation": "REPLACE",
  "implementation_strategy": "REPLACE",
  "regression_risks": "REPLACE",
  "verification_method": "REPLACE",
  "affected_files": [],
  "affected_components": [],
  "affected_flows": [],
  "required_tests": [],
  "dependencies": [],
  "evidence_ids": [],
  "control_ids": [],
  "severity": "MEDIUM",
  "confidence": "LOW",
  "claim_status": "NOT_VERIFIED",
  "root_cause_status": "UNKNOWN",
  "priority": "P2",
  "status": "open",
  "impacts": {
    "security": "NOT_ASSESSED",
    "performance": "NOT_ASSESSED",
    "reliability": "NOT_ASSESSED",
    "maintainability": "NOT_ASSESSED",
    "user": "NOT_ASSESSED",
    "business": "NOT_ASSESSED"
  },
  "verification_ids": [],
  "owner": "REPLACE",
  "risk_expiry": null,
  "duplicate_of": null,
  "priority_rationale": "REPLACE",
  "revision": "REPLACE",
  "required_gate_ids": []
}
